,Vote ID,File,Order of vote,Date,Title,Procedure,Leg/Non-Leg/Bud,Type of Vote,Voting Rule,Rapporteur,Code,Interinstitutional file number,Link,Committee responsabile,Policy area,Subject,Final vote?,Am No.,Author,RCV,Vote,Yes,No,Abs,ECR,EFD/IDG,EPP,Greens/EFA,NI,REG,S&D,The Left,ECR%,EFD/IDG%,EPP%,Greens/EFA%,NI%,REG%,S&D%,The Left%,General Majority,Right Majority,Left Majority,Consensus,Report link,Summary link,Summary text
1044,1045,33,1,13.05.2020,EU-Belarus Agreement on facilitation of issuance of visas,***,Leg,Draft legislative resolution,s,Kovařík,A9-0090/2020,2019/0182/NLE,https://www.europarl.europa.eu/doceo/document/A-9-2020-0090_EN.html,"Committee on Civil Liberties, Justice and Home Affairs","Civil liberties, justice & home affairs",vote: consent,1.0,,0,RCV,+,634,48,4,57.0,28.0,174.0,66.0,32.0,102.0,137.0,38.0,0.919,0.384,0.956,0.892,0.561,0.944,0.89,0.927,1,0,0,0,https://oeil.secure.europarl.europa.eu/oeil/popups/ficheprocedure.do?lang=en&reference=2019/0182(NLE),https://oeil.secure.europarl.europa.eu/oeil/popups/summary.do?id=1589603&t=e&l=en,"PURPOSE: to conclude the Agreement between the European Union and the Republic of Belarus on the facilitation of the issuance of visas. PROPOSED ACT: Council Decision. ROLE OF THE EUROPEAN PARLIAMENT: Council may adopt the act only if Parliament has given its consent to the act. BACKGROUND: in the context of the Eastern Partnership Summit Declaration of 7 May 2009, the Union and the partner countries expressed their political support towards liberalisation of the visa regime in a safe and secure environment and reaffirmed their intention to take gradual steps towards a visa free regime for their citizens in due course. On that basis, the Commission presented on 12 November 2010, a recommendation to the Council with a view to obtaining directives to negotiate Agreements with the Republic of Belarus on, respectively, the facilitation of the issuance of short-stay visas, and readmission of persons residing without authorisation. Negotiations with Belarus were officially opened in Brussels on 30 January 2014 and resulted in an agreement initialled on 17 June 2019. In the meantime, Belarus, the European Union and seven participating Member States (Bulgaria, Romania, Lithuania, Poland, Hungary, Finland and Latvia) signed a joint declaration on a mobility partnership on 13 October 2016. CONTENT: the Commission proposes that the Council approve the conclusion of the Agreement between the European Union and the Republic of Belarus on the facilitation of the issuance of visas. The purpose of the Agreement is to facilitate, on the basis of reciprocity, the issuance of visas to citizens of the Union and Belarus for intended stays of no more than 90 days in any 180-day period. The Commission considers that the objectives set by the Council in its negotiating directives have been achieved and that the draft agreement is acceptable to the Union. The main elements of the final agreement are as follows: - for all visa applicants, a decision on whether or not to issue a visa must, in principle, be taken within 10 calendar days. This period may be extended to a maximum of 30 calendar days when further examination is required. In urgent cases, it may be reduced to two working days or less; - the amount of fees charged for processing visa applications from citizens of the European Union and Belarus shall be EUR 35. These fees shall apply to all visa applicants. In addition, the following categories of persons shall be exempt from these visa fees: children under 12 years of age, persons with disabilities, close relatives, members of official delegations; - the documents required to justify the purpose of the trip have been simplified for certain categories of applicants (e.g. close relatives, business people, members of official delegations, primary and secondary school pupils, students, persons participating in scientific, cultural and sporting events, journalists, etc.); - simplified conditions are provided for the issue of multiple-entry visas valid from 1 to 5 years to certain categories of persons (e.g. members of governments, parliaments and courts, permanent members of official delegations, spouses and children visiting European Union citizens legally residing in the territory of Belarus, or citizens of the Republic of Belarus legally residing in a Member State, persons participating in official, scientific or cultural exchange programmes or cross-border programmes, international sports events); - citizens of the European Union and citizens of Belarus holding a valid biometric diplomatic passport and holders of a valid EU laissez-passer are exempt from the visa requirement for short stays. However, the final assessment of Belarus’ system of issuance will have to be made by the Commission, in consultation with the Member States, before the conclusion of the Agreement. The importance of the fundamental principles governing the cooperation between the Parties as well as the obligations and responsibilities, including the respect of human rights and democratic principles, stemming from the relevant international instruments to which they are bound, is underlined in a preamble to the Agreement. The Parties may suspend the Agreement in whole or in part for any reason, including grounds for suspension such as breach or abuse of a provision of the Agreement, human rights and democracy considerations."
1045,1046,33,1,13.05.2020,Amending the International Convention for the Conservation of Atlantic Tunas (ICCAT) - Protocol,***,Leg,Draft legislative resolution,s,Conte,A9-0089/2020,2019/0225/NLE,https://www.europarl.europa.eu/doceo/document/A-9-2020-0089_EN.html,Committee on Fisheries,Fisheries,vote: consent,1.0,,0,RCV,+,667,2,13,63.0,54.0,174.0,68.0,36.0,102.0,131.0,39.0,1.016,0.74,0.956,0.919,0.632,0.944,0.851,0.951,1,0,0,0,https://oeil.secure.europarl.europa.eu/oeil/popups/ficheprocedure.do?lang=en&reference=2019/0225(NLE),https://oeil.secure.europarl.europa.eu/oeil/popups/summary.do?id=1599731&t=e&l=en,"PURPOSE: to conclude, on behalf of the European Union, of the Protocol to amend the International Convention for the Conservation of Atlantic Tunas (ICCAT). PROPOSED ACT: Council Decision. ROLE OF THE EUROPEAN PARLIAMENT: Council may adopt the act only if Parliament has given its consent to the act. BACKGROUND: the International Convention for the Conservation of Atlantic Tunas (ICCAT Convention) aims, by establishing the ICCAT, to promote cooperation in maintaining the populations of tuna and tuna-like fish in the Atlantic Ocean at levels that permit the maximum sustainable catch for food and other purposes. The Convention entered into force on 21 March 1969. The Union is a party to the Convention, having approved it pursuant to the Council Decision of 9 June 1986. From 2013 to 2018, discussions took place within the ICCAT Commission on the changes that are needed to the Convention. As a result, a Protocol has been drafted to amend to the Convention. The Protocol amending ICCAT, once signed (and provisionally applied from the date of its entry into force for other Contracting Parties, pending its entry into force for the Union), must now be approved. CONTENT: the draft Council Decision seeks approval, on behalf of the Union, of the Protocol to amend the International Convention for the Conservation of Atlantic Tunas. The Protocol is consistent with Regulation (EU) No 1380/2013 of the European Parliament and of the Council on the Common Fisheries Policy, which provides that the Union shall: - ensure that fishing and aquaculture activities are environmentally sustainable in the long term and are managed in a way that is consistent with the objectives of achieving economic, social and employment benefits, and of contributing to the availability of food supplies; - apply the precautionary approach to fisheries management, and is to aim to ensure that exploitation of living marine biological resources restores and maintains population of harvested species above levels which can produce the maximum sustainable yield; - adopt management and conservation measures based on best available scientific advice, to support the development of scientific knowledge and advice, to gradually eliminate discards and to promote fishing methods that contribute to more selective fishing and the avoidance and reduction, as far as possible, of unwanted catches, to fishing with low impact on the marine ecosystem and fishery resources; - apply those objectives and principles in the conduct of its external fisheries relations. In accordance with the Joint Communication by the High Representative of the EU for Foreign Affairs and Security Policy and the European Commission ‘International ocean governance: an agenda for the future of oceans’6 and the Council conclusions on that Joint Communication, promoting measures to support and enhance the effectiveness of RFMOs and, where relevant, improve their governance is a central feature of the Union’s action in these fora. The Protocol meets these objectives."
1046,1047,33,1,13.05.2020,EC-Mauritania Fisheries Partnership Agreement: fishing opportunities and financial contribution. Extension of the Protocol,***,Leg,Draft legislative resolution,s,Aguilera,A9-0088/2020,2019/0210/NLE,https://www.europarl.europa.eu/doceo/document/A-9-2020-0088_EN.html,Committee on Fisheries,Fisheries,vote: consent,1.0,,0,RCV,+,575,58,57,58.0,2.0,170.0,64.0,19.0,100.0,139.0,23.0,0.935,0.027,0.934,0.865,0.333,0.926,0.903,0.561,1,0,0,0,https://oeil.secure.europarl.europa.eu/oeil/popups/ficheprocedure.do?lang=en&reference=2019/0210(NLE),https://oeil.secure.europarl.europa.eu/oeil/popups/summary.do?id=1598932&t=e&l=en,"CONTENT: to conclude the Agreement in the form of an exchange of letters between the European Union and the Islamic Republic of Mauritania concerning the extension to the Protocol setting out the fishing opportunities and financial contribution provided for in the Fisheries Partnership Agreement between the European Community and the Islamic Republic of Mauritania, expiring on 15 November 2019. PROPOSED ACT: Council Decision. ROLE OF THE EUROPEAN PARLIAMENT: Council may adopt the act only if Parliament has given its consent to the act. BACKGROUND: in accordance with a Council Decision, the Agreement in the form of an exchange of letters concerning the extension of the Protocol setting out the fishing opportunities and financial contribution provided for in the Fisheries Partnership Agreement between the European Community and Mauritania, expiring on 15 November 2019, was signed. It is now necessary for it to be approved. CONTENT: the draft Council Decision concerns the approval, on behalf of the Union, of the Agreement in the form of an Exchange of Letters between the European Union and the Islamic Republic of Mauritania concerning the extension of the Protocol setting out the fishing opportunities and financial contribution provided for in the Fisheries Partnership Agreement between the European Community and the Islamic Republic of Mauritania, expiring on 15 November 2019. The objective of the Agreement in the form of an Exchange of Letters is to enable the European Union and Mauritania to continue to work together on promoting a sustainable fisheries policy and the sound exploitation of fisheries resources in Mauritanian waters and to allow Union vessels to carry out their fishing activities in those waters."
1048,1049,33,1,13.05.2020,International road passenger transport services by coach and bus in the border regions: cabotage operations between Germany and Switzerland,***I,Leg,Draft legislative resolution,s,Ferber,A9-0006/2020,2019/0107/COD,https://www.europarl.europa.eu/doceo/document/A-9-2020-0006_EN.html,Committee on Transport and Tourism,Transport & tourism,single vote,1.0,,0,RCV,+,676,1,13,64.0,60.0,174.0,68.0,34.0,102.0,140.0,34.0,1.032,0.822,0.956,0.919,0.596,0.944,0.909,0.829,1,0,0,0,https://oeil.secure.europarl.europa.eu/oeil/popups/ficheprocedure.do?lang=en&reference=2019/0107(COD),https://oeil.secure.europarl.europa.eu/oeil/popups/summary.do?id=1583141&t=e&l=en,"PURPOSE: to empower Germany to amend its existing bilateral road transport agreement with Switzerland with a view to authorising cabotage operations in the course of international road passenger transport services by coach and bus in the border regions between the two countries. PROPOSED ACT: Decision of the European Parliament and the Council. ROLE OF THE EUROPEAN PARLIAMENT: the European Parliament decides in accordance with the ordinary legislative procedure and on an equal footing with the Council. BACKGROUND: the two-way carriage of passengers and goods by road between Switzerland and the EU is regulated by the Land Transport Agreement between the EU and Switzerland ('EU Agreement'). Under the EU Agreement, the transport of passengers by coach and bus between two points situated on the territory of the same Contracting Party by carriers established in the territory of the other Contracting Party, known as cabotage, is not authorised. This means that the carriers operating the passenger services which cross the border can only carry passengers across the border or within the territory of the Contracting Party they are established in. Bus and coach operators established in Switzerland may not carry passengers between two points on the German side of the border and operators established in the EU may not carry passengers between two points on the Swiss side of the border. However, Article 20(2) of the EU Agreement specifically allows pre-existing rights under bilateral agreements concluded between individual EU Member States and Switzerland that were in force at the time of conclusion of the EU Agreement to continue to be exercised. The border regions of Germany and Switzerland are closely integrated. Many Germans commute to work in Switzerland and vice versa and there is vibrant cross-border passenger traffic by road. A number of bus and coach services are offered which cross the border and thus connect the border regions of the two countries. By letter dated 11 May 2017, Germany informed the Commission that it would appreciate if the Union was to empower it to amend its bilateral road transport agreement with Switzerland of 1953 with a view to authorising cabotage operations during the provision of passenger transport services by coach and bus in the border region between the two countries. Switzerland informed the Commission that it was also interested in amending this agreement to that effect. CONTENT: the proposed Decision seeks to empower Germany to amend its existing bilateral road transport agreement with Switzerland with a view to authorising cabotage operations in the respective border regions of Germany and Switzerland in the course of the provision of coach and bus services between the two countries, provided that there is no discrimination between carriers established in the Union and no distortion of competition. Cabotage operations allow increasing the load factor of the vehicles which increases the economic efficiency of the services. The authorisation of cabotage operations in the context of the provision of international passenger transport services by coach and bus in the border regions between Germany and Switzerland would allow the carriers involved to become more competitive and efficient. In order to ensure that the cabotage operations concerned do not excessively alter the functioning of the internal market for coach and bus services, as established by Regulation (EC) No 1073/2009, their authorisation should be subject to the conditions that there is no discrimination between carriers established within the Union and no distortion of competition. For the same reason, cabotage operations should only be authorised in the border regions of Germany in the course of the provision of coach and bus services between Germany and Switzerland. As border regions of Germany shall be considered the administrative districts of Freiburg and Tübingen in Baden-Württemberg and the administrative district of Swabia in Bavaria. This proposal is based on a request by Germany and concerns only this Member State. A similar request has been received by Italy which is subject to a parallel procedure."
1049,1050,33,1,13.05.2020,International road passenger transport services by coach and bus in the border regions: cabotage operations between Italy and Switzerland,***I,Leg,Draft legislative resolution,s,Ferber,A9-0007/2020,2019/0108/COD,https://www.europarl.europa.eu/doceo/document/A-9-2020-0007_EN.html,Committee on Transport and Tourism,Transport & tourism,single vote,1.0,,0,RCV,+,678,1,12,64.0,61.0,175.0,68.0,34.0,102.0,140.0,34.0,1.032,0.836,0.962,0.919,0.596,0.944,0.909,0.829,1,0,0,0,https://oeil.secure.europarl.europa.eu/oeil/popups/ficheprocedure.do?lang=en&reference=2019/0108(COD),https://oeil.secure.europarl.europa.eu/oeil/popups/summary.do?id=1583144&t=e&l=en,"PURPOSE: to empower Italy to amend its existing bilateral road transport agreement with Switzerland with a view to authorising cabotage operations in the course of international road passenger transport services by coach and bus in the border regions between the two countries. PROPOSED ACT: Decision of the European Parliament and the Council. ROLE OF THE EUROPEAN PARLIAMENT: the European Parliament decides in accordance with the ordinary legislative procedure and on an equal footing with the Council. BACKGROUND: the two-way carriage of passengers and goods by road between Switzerland and the EU is regulated by the Land Transport Agreement between the EU and Switzerland ('EU Agreement'). Under the EU Agreement, the transport of passengers by coach and bus between two points situated on the territory of the same Contracting Party by carriers established in the territory of the other Contracting Party, known as cabotage, is not authorised. This means that the carriers operating the passenger services which cross the border can only carry passengers across the border or within the territory of the Contracting Party they are established in. Bus and coach operators established in Switzerland may not carry passengers between two points on the German side of the border and operators established in the EU may not carry passengers between two points on the Swiss side of the border. However, Article 20(2) of the EU Agreement specifically allows pre-existing rights under bilateral agreements concluded between individual EU Member States and Switzerland that were in force at the time of conclusion of the EU Agreement to continue to be exercised. The border regions of Italy and Switzerland are closely integrated. Many Italians commute to work in Switzerland and vice versa and there is vibrant cross-border passenger traffic by road. A number of bus and coach services are offered which cross the border and thus connect the border regions of the two countries. By letter dated 7 February 2018, Italy informed the Commission that it would like to negotiate and conclude an agreement with Switzerland which authorises cabotage operations during the provision of international passenger transport services by coach and bus in the border regions between the two countries. Switzerland informed the Commission that it was also interested in concluding such an agreement. CONTENT: the proposed Decision seeks to empower Italy to amend its existing bilateral road transport agreement with Switzerland with a view to authorising cabotage operations in the respective border regions of Italy and Switzerland in the course of the provision of coach and bus services between the two countries, provided that there is no discrimination between carriers established in the Union and no distortion of competition. Cabotage operations allow increasing the load factor of the vehicles which increases the economic efficiency of the services. The authorisation of cabotage operations in the context of the provision of international passenger transport services by coach and bus in the border regions between Italy and Switzerland would allow the carriers involved to become more competitive and efficient. This could further strengthen the close integration of these border regions. In order to ensure that the cabotage operations concerned do not excessively alter the functioning of the internal market for coach and bus services, as established by Regulation (EC) No 1073/2009, their authorisation should be subject to the conditions that there is no discrimination between carriers established within the Union and no distortion of competition. For the same reason, cabotage operations should only be authorised in the border regions of Italy in the course of the provision of coach and bus services between Italy and Switzerland. As border regions of Italy shall be considered the regions Piedmont and Lombardy and the autonomous regions Valle d'Aosta and TrentinoAlto Adige. This proposal is based on a request by Germany and concerns only this Member State. A similar request has been received by Italy which is subject to a parallel procedure."
