,Vote ID,File,Order of vote,Date,Title,Procedure,Leg/Non-Leg/Bud,Type of Vote,Voting Rule,Rapporteur,Code,Interinstitutional file number,Link,Committee responsabile,Policy area,Subject,Final vote?,Am No.,Author,RCV,Vote,Yes,No,Abs,ECR,EFD/IDG,EPP,Greens/EFA,NI,REG,S&D,The Left,ECR%,EFD/IDG%,EPP%,Greens/EFA%,NI%,REG%,S&D%,The Left%,General Majority,Right Majority,Left Majority,Consensus,Report link,Summary link,Summary text
10708,10709,106,1,11.11.2021,European Union Agency for Asylum,***I,Leg,Draft legislative resolution,s,Yoncheva,A8-0392/2016,2016/0131/COD,https://www.europarl.europa.eu/doceo/document/A-8-2016-0392_EN.html,"Committee on Civil Liberties, Justice and Home Affairs","Civil liberties, justice & home affairs",Provisional agreement,0.0,100,committee,RCV,+,396,92,73,0.0,0.0,131.0,53.0,8.0,85.0,115.0,4.0,0.0,0.0,0.72,0.716,0.14,0.787,0.747,0.098,1,0,0,0,https://oeil.secure.europarl.europa.eu/oeil/popups/ficheprocedure.do?lang=en&reference=2016/0131(COD),https://oeil.secure.europarl.europa.eu/oeil/popups/summary.do?id=1469964&t=e&l=en,"The Committee on Civil Liberties, Justice and Home Affairs adopted the report by Péter NIEDERMÜLLER (S&D, HU) on the proposal for a regulation of the European Parliament and of the Council on the European Union Agency for Asylum and repealing Regulation (EU) No 439/2010. The committee recommended that the European Parliament’s position adopted at first reading following the ordinary legislative procedure should amend the Commission proposal as follows: Strengthen the Agency’s mission : the future Agency shall support, facilitate, coordinate and strengthen practical cooperation, information exchange and the implementation of the Common European Asylum System (CEAS), including fundamental rights compliance, by performing the following tasks: assist Member States on training or provide training to Member States' experts from all national administrations, courts and tribunals, and national services responsible for asylum matters: the main objective would be to promote best practice and the highest standards in the implementation of EU asylum legislation and to protect the needs of unaccompanied minors and vulnerable persons, integration and resettlement issues and other relevant asylum issues; assist Member States with a view to guaranteeing high standards and respect of fundamental rights; deploy liaison officers in Member States and, where appropriate, third countries; evaluate the implementation of the CEAS, as well as the asylum and reception systems and the reception capacity of the Member States; assist Member States with regard to humanitarian visas; carry out resettlement missions; support Member States with a view to the correct implementation of the Dublin system as regards determining the responsibility of Member States for asylum applications. Cooperation with other organisations : in order to perform its tasks, the Agency shall work in close cooperation with the UNHCR, relevant intergovernmental organisations, such as the Council of Europe and the International Organisation for Migration, and relevant non-governmental organisations, researchers and academics. It shall also close collaboration with the European Border and Coast Guard and shall take into account the risk analysis and vulnerability assessment carried out by that Agency to ensure the highest level of consistency and convergence in the information provided by both Agencies. All relevant information shall be sent to the European Parliament. Transparency, communication and cooperation : the Agency and the Member States' asylum authorities, national immigration and asylum services and other national services shall be subject to a duty to cooperate in good faith and an obligation to exchange all relevant information on a regular basis. Where the Executive Director has established that a Member State's asylum authorities, national immigration and asylum services and other national services have systematically failed to comply with the duty to cooperate in good faith, including the duty to provide timely and accurate information, he or she shall submit a report to the Management Board and to the Commission and include such information in the annual activity report on the situation of asylum in the Union. The Agency should focus on the following key issues: the processing of applications for international protection by national administrations and authorities, including on the duration of processing of applications and on other procedural aspects; the Agency shall study the differences in the recognition rates recorded by Member States regarding applications for international protection from applicants of a given country of origin which is the subject of the common analysis; the root causes, migratory and refugee flows, particularly on the presence of unaccompanied minors, reception capacity and resettlement needs, as well as on any sudden arrivals of large numbers of third-country nationals which may cause disproportionate pressure on asylum and reception systems, with a view to foster quick and reliable mutual information to the Member States and to identify possible risks to the Member States' asylum systems; issues regarding a common EU list of safe countries. The information relating to the drawing up of this list should be forwarded to the European Parliament. In this regard, it is provided that the Parliament, the Council or the Commission may request the Agency to examine the situation in one of the third countries in order to determine whether the conditions and criteria for inclusion on the safe list is still relevant; the assessment of the asylum situation in the Member States: to this end, the Agency will be able to carry out on-site (possibly unannounced) inspections and case sampling on the basis of information provided by the applicants and on the evaluations transmitted by the bodies and organisations with which it cooperates. Providing the Agency with new operational capacities : it is proposed to provide new operational capacities to the Agency in the field of human resources. In order to carry out its task of monitoring and evaluating the implementation of the Common European Asylum System and the Member States’ asylum and reception systems in an effective, impartial and independent manner, the Agency shall have an appropriate number of permanent and temporary staff and adequate financial resources. The task of monitoring and evaluating the CEAS should not be carried out by seconded experts, but by the Agency’s own staff, trained for that purpose. Each Member State shall contribute to the number of experts, in accordance with Annex 1a. Member States who do not make available the required number of experts shall instead provide a financial contribution to a platform set up at Union level, contributing to addressing challenges due to disproportionate pressure and managed directly or indirectly by the Agency. The Agency shall inform the European Parliament on an annual basis of the number of experts that each Member State has committed and the number experts actually deployed from the pool. Provision of reception facilities : for the purposes of organising and coordinating the operational and technical measures, the Agency may enter into emergency standby agreements with the UNHCR and relevant intergovernmental or non-governmental organisations to complement the Agency’s capacity to provide operational and technical assistance to Member States, in particular with regard to the setting up or provision of reception facilities, the provision of information to asylum seekers, identification, referral and assistance to vulnerable persons and the provision of interpretation services. Deployment of migration management support teams : where a Member State faces disproportionate migratory challenges at particular hotspot areas of its external borders characterised by large inward mixed migratory flows, that Member State may request technical and operational reinforcement by migration management support teams. The Member State shall submit a request for reinforcement and an assessment of its needs to the Agency and other relevant Union agencies, in particular the European Border and Coast Guard and Europol. The Executive Director, in coordination with other relevant Union agencies, shall assess a Member State's request for reinforcement and the assessment of its needs for the purpose of defining a comprehensive reinforcement package consisting of various activities coordinated by the relevant Union agencies to be agreed upon by the Member State concerned. During deployment of asylum support teams or experts from the asylum intervention pool, the host Member State shall issue instructions to the teams in accordance with the operational plan. It is also provided that the Agency deploy liaison officers in Member States and, where appropriate, third countries. The tasks of the Agency's liaison officers shall include, in compliance with Union law and in full respect of fundamental rights, establishing and maintaining contacts with the competent authorities of the third country to which they are assigned. The decision to deploy liaison officers to third countries shall be subject to receiving the prior opinion of the Commission. The European Parliament shall be kept fully informed of those activities without delay. It should be noted that where experts of an asylum support team or from the asylum intervention pool are operating in a third country, the Agency shall be liable for any damage caused by them during their activities. Evaluations carried out by the Agency : it is proposed that Member States shall be monitored every three years (and not five as proposed by the Commission) in particular on all aspects of the CEAS. This can also be seen as a preventive measure, since deficiencies may be detected and rectified in a timely matter. The result of these assessments would also provide a clear picture on the overall functioning of CEAS. Besides this general assessment, it is proposed that there is a need for the possibility of an assessment/monitoring to be decided on an annual basis. Such assessment is to be linked with the information analysis prepared by the Agency. The annual assessment could be carried out in one or more Member States, depending on the abovementioned information analysis carried out by the Agency. Implementation by Member States of the CEAS and liaison officers in Member States : it is proposed that the Agency initiate a monitoring exercise which would only be carried out in specific cases, where events in any of the Member States give rise to serious concerns regarding the functioning of any aspects of that Member States’ asylum system and may put the functioning of the CEAS in jeopardy if not handled in a timely manner. The Agency may decide that a liaison officer covers up to four Member States which are geographically close to each other. A cooperation procedure between the Agency, liaison officers and the Member States is proposed in this regard. Following the Agency’s remarks, the Commission may take measures to address the serious shortcomings observed and inform the European Parliament thereof. Fundamental Rights : Members proposed appointing a fundamental rights officer responsible for drawing up the fundamental rights strategy, monitoring compliance with fundamental rights and promoting the respect of fundamental rights by the Agency. The officer shall be independent in the performance of his or her duties, and shall have access to all information concerning respect for fundamental rights, including by carrying out on-site visits to any operational activity carried out by the Agency. The budget, including the establishment plan, shall include sufficient financing of the Fundamental Rights Strategy and the Fundamental Rights Officer amounting to at least 5 % of the overall budget. The Agency shall draw up and further develop and implement a fundamental rights strategy including an effective mechanism to monitor the respect for fundamental rights in all the activities of the Agency. Various provisions : it is proposed to establish: a code of conduct applicable to all experts involved in support operations laying down provisions to guarantee the principles of the rule of law and respect for fundamental rights with particular focus on children, and other persons in a vulnerable situation; a compliant mechanism to monitor and ensure the respect for fundamental rights in all the activities of the Agency; a prevention of conflicts of interest mechanism requiring the members of its bodies and its staff members to avoid any situation liable to give rise to a conflict of interest during their employment or term of office and to report such situations."
10710,10711,106,1,11.11.2021,EU/Australia Agreement: modification of concessions on all the tariff-rate quotas included in the EU Schedule CLXXV,***,Leg,Draft legislative resolution,s,Caspary,A9-0306/2021,2021/0029/NLE,https://www.europarl.europa.eu/doceo/document/A-9-2021-0306_EN.html,Committee on International Trade,International trade,vote: consent,1.0,,0,RCV,+,451,53,62,48.0,16.0,134.0,41.0,22.0,68.0,115.0,7.0,0.774,0.219,0.736,0.554,0.386,0.63,0.747,0.171,1,0,0,0,https://oeil.secure.europarl.europa.eu/oeil/popups/ficheprocedure.do?lang=en&reference=2021/0029(NLE),https://oeil.secure.europarl.europa.eu/oeil/popups/summary.do?id=1682253&t=e&l=en,"The European Parliament adopted by 451 votes to 53, with 62 abstentions, a legislative resolution on the draft Council decision on the conclusion, on behalf of the Union, on the draft Council decision on the conclusion, on behalf of the Union, of the Agreement in the form of an Exchange of Letters between the European Union and the Commonwealth of Australia pursuant to Article XXVIII of the General Agreement on Tariffs and Trade (GATT) 1994 relating to the modification of concessions on all the tariff-rate quotas included in the EU Schedule CLXXV as a consequence of the United Kingdom's withdrawal from the European Union. Following the recommendation of the Committee on International Trade, Parliament gave its consent to the conclusion of the agreement. As a reminder, the EU formally launched the negotiation process (under Article XXVIII of the General Agreement on Tariffs and Trade (GATT) 1994) with several WTO members in Geneva in October 2018. The negotiations are based on a ‘joint approach’ developed in 2017 by the EU and the UK on how to allocate the quantitative commitments contained in the EU-28's WTO schedule for the EU's 143 WTO tariff-rate quotas for agricultural, fisheries and industrial products. The principle of the applied methodology is based on the trade flows in the EU-27 and the UK over a representative reference period (of three years between 2013 and 2015) for all WTO tariff-rate quotas. The agreed methodology of the apportionment is described in detail in Regulation (EU) 2019/216 of the European Parliament and of the Council. On 15 June 2018, the Council authorised the Commission to launch negotiations under Article XXVIII GATT with the relevant WTO Members, including Australia, with a view to apportioning the Union's WTO concessions on tariff-rate quotas. Australia has negotiating rights for 14 tariff quotas and consultation rights for 6 tariff quotas. Negotiations with Australia resulted in an agreement that was initialled on 18 December 2020 in Geneva."
10755,10756,107,1,23.11.2021,Insolvency proceedings: replacing Annexes A and B to the Regulation,***I,Leg,Draft legislative resolution,s,Vázquez Lázara,A9-0293/2021,2021/0118/COD,https://www.europarl.europa.eu/doceo/document/A-9-2021-0293_EN.html,Committee on Legal Affairs,Legal affairs,single vote,1.0,,0,RCV,+,671,4,13,61.0,54.0,174.0,70.0,37.0,99.0,138.0,38.0,0.984,0.74,0.956,0.946,0.649,0.917,0.896,0.927,1,0,0,0,https://oeil.secure.europarl.europa.eu/oeil/popups/ficheprocedure.do?lang=en&reference=2021/0118(COD),https://oeil.secure.europarl.europa.eu/oeil/popups/summary.do?id=1661518&t=e&l=en,"PURPOSE: to update Annexes A and B of Regulation (EU) 2015/848 on insolvency proceedings to ensure that the scope of the Regulation reflects the current legal framework of the Member States on insolvency. PROPOSED ACT: Regulation of the European Parliament and of the Council. ROLE OF THE EUROPEAN PARLIAMENT: the European Parliament decides in accordance with the ordinary legislative procedure and on an equal footing with the Council. BACKGROUND: Regulation (EU) 2015/848 is an important instrument for judicial cooperation in civil matters at EU level. It contains a comprehensive set of rules directly applicable to cross-border insolvency proceedings which are referred to in Annex A and to types of insolvency practitioners referred to in Annex B. These two annexes list exhaustively, respectively, the insolvency proceedings and the insolvency practitioners provided for in the laws of the Member States and to which the Regulation applies. It is therefore important that these annexes are regularly updated to take account of the current legal situation in the Member States. In October 2020, the Netherlands notified the Commission of recent changes to its national insolvency legislation, introducing a new preventive insolvency regime and new categories of insolvency practitioners. Notifications were subsequently received from Italy, Lithuania, Cyprus and Poland in December 2020. The Commission has analysed the notifications from these Member States carefully to ensure that they meet the requirements of the Regulation. CONTENT: the Commission proposal replaces the lists in Annexes A and B of Regulation (EU) 2015/848 with new lists that take into account the information notified by the Netherlands, Italy, Lithuania, Cyprus and Poland. It merely amends these annexes to accurately reflect the content of the national notifications and to adapt the annexes listing the respective national procedures or categories of insolvency practitioners in this area."
10756,10757,107,1,23.11.2021,Integrated farm statistics: Union contribution under the MFF for the years 2021 to 2027,***I,Leg,Draft legislative resolution,s,Terras,A9-0310/2021,2021/0270/COD,https://www.europarl.europa.eu/doceo/document/A-9-2021-0310_EN.html,Committee on Agriculture and Rural Development,Agriculture,single vote,1.0,,0,RCV,+,669,17,2,60.0,54.0,174.0,70.0,36.0,100.0,137.0,38.0,0.968,0.74,0.956,0.946,0.632,0.926,0.89,0.927,1,0,0,0,https://oeil.secure.europarl.europa.eu/oeil/popups/ficheprocedure.do?lang=en&reference=2021/0270(COD),https://oeil.secure.europarl.europa.eu/oeil/popups/summary.do?id=1672140&t=e&l=en,"PURPOSE: to amend Regulation (EU) 2018/1091 as regards the Union contribution to integrated farm statistics under the financial framework 2021-2027. PROPOSED ACT: Regulation of the European Parliament and of the Council. ROLE OF THE EUROPEAN PARLIAMENT: the European Parliament decides in accordance with the ordinary legislative procedure and on an equal footing with the Council. BACKGROUND: Regulation (EU) 2018/1091 on integrated farm statistics requires Member States to carry out integrated farm surveys in 2020, 2023 and 2026. The Regulation contains a provision on the establishment of the budget for the collection of data for the surveys to be carried out in 2023 and 2026. It establishes the financial envelope for the entire duration of the relevant multiannual financial framework (MFF). In accordance with Regulation (EU) 2018/1091, the amount of the Union contribution to integrated farm statistics under the MFF 2021-2027 should be fixed by the European Parliament and the Council, on a proposal from the Commission, once the MFF 2021-2027 has entered into force. The proposal is part of the strategy for agricultural statistics for 2020 and beyond, a major programme to modernise EU agricultural statistics produced by the European Commission in close cooperation with the Member States. It aims to ensure the quality and comparability of European agricultural statistics collected and compiled according to the same principles in all Member States. CONTENT: this proposal concerns the financing of integrated statistics on agricultural holdings for the period 2021-2027. It establishes a budget of EUR 40 million for the period 2021-2027 (of which EUR 36.4 million is for grants to national statistical institutes and other national authorities). The amount proposed for 2021-2027 should finance the farm structure surveys conducted in 2023 and 2026 only, including the costs related to the management, maintenance and development of the databases used by the Commission to process the data supplied by Member States. The EU's financial contribution for the grants should be provided by the European Agricultural Guarantee Fund."
10757,10758,107,1,23.11.2021,Packaged retail and insurance-based investment products (PRIIPs): key information documents. Extension of the transitional arrangement,***I,Leg,Draft legislative resolution,s,Fernández,A9-0297/2021,2021/0215/COD,https://www.europarl.europa.eu/doceo/document/A-9-2021-0297_EN.html,Committee on Economic and Monetary Affairs,Economic & monetary affairs,single vote,1.0,,0,RCV,+,608,29,51,61.0,32.0,174.0,70.0,28.0,100.0,138.0,5.0,0.984,0.438,0.956,0.946,0.491,0.926,0.896,0.122,1,0,0,0,https://oeil.secure.europarl.europa.eu/oeil/popups/ficheprocedure.do?lang=en&reference=2021/0215(COD),https://oeil.secure.europarl.europa.eu/oeil/popups/summary.do?id=1670361&t=e&l=en,"PURPOSE: to extend the transitional arrangement for management companies, investment companies and persons advising on, or selling, units of undertakings for collective investment in transferable securities (UCITS) and non-UCITS. PROPOSED ACT: Regulation of the European Parliament and of the Council. ROLE OF THE EUROPEAN PARLIAMENT: the European Parliament decides in accordance with the ordinary legislative procedure and on an equal footing with the Council. BACKGROUND: Regulation (EU) No 1286/2014 enables retail investors to better understand and compare packaged retail and insurance-based investment products (PRIIPs) and make better-informed investment decisions. To meet its objectives, Regulation requires PRIIPs manufacturers to comply with a uniform set of product disclosure requirements and provide retail investors with a key information document (KID) on each PRIIP they offer. Article 32 of Regulation (EU) No 1286/2014 provides for a transitional arrangement whereby management companies, investment companies and persons advising on, or selling, units of UCITS and non-UCITS within the meaning of Directive 2009/65/EC of the European Parliament and of the Council are temporarily exempted from the requirement to provide retail investors with a KID. This arrangement currently applies until 31 December 2021. Commission Delegated Regulation (EU) 2017/653 supplements Regulation (EU) No 1286/2014 by laying down regulatory technical standards with regard to the presentation, content and standard format of the key information document. The Commission adopted Commission Delegated Regulation amending Delegated Regulation (EU) 2017/653 to make it easier for management companies, investment companies, and persons advising on, or selling, units of UCITS and non-UCITS. However, the date of application of Delegated Regulation has been set on 1 July 2022 to give those management companies, investment companies, and persons advising on, or selling, units of UCITS and non-UCITS sufficient time to prepare for the end of the transitional arrangement and thus for the obligation to draw up a key information document. This proposal is accompanied by a proposal amending Directive 2009/65/EC as regards the use of key information documents by management companies of undertakings for collective investment in transferable securities (UCITS). CONTENT: the Commission proposes to extend the transitional arrangement provided for in Regulation (EU) No 1286/2014 until 30 June 2022. This will give stakeholders sufficient time to prepare for the end of the transitional arrangement and implement the other proposed measure (which provides for amendments to Delegated Regulation (EU) 2017/653). Under this proposal, Regulation (EU) No 1286/2014 would apply to management companies, investment companies and persons advising on or selling units of UCITS and non-UCITS on the same date as the amendments to Directive 2009/65/EC and Delegated Regulation (EU) 2017/653, i.e. from 1 July 2022."
