,Vote ID,File,Order of vote,Date,Title,Procedure,Leg/Non-Leg/Bud,Type of Vote,Voting Rule,Rapporteur,Code,Interinstitutional file number,Link,Committee responsabile,Policy area,Subject,Final vote?,Am No.,Author,RCV,Vote,Yes,No,Abs,ECR,EFD/IDG,EPP,Greens/EFA,NI,REG,S&D,The Left,ECR%,EFD/IDG%,EPP%,Greens/EFA%,NI%,REG%,S&D%,The Left%,General Majority,Right Majority,Left Majority,Consensus,Report link,Summary link,Summary text
82,83,10,1,22.10.2019,European Globalisation Adjustment Fund (2014-2020),***I,Leg,Draft legislative resolution,s,Blinkevičiūtė,A9-0015/2019,2019/0180/COD,https://www.europarl.europa.eu/doceo/document/A-9-2019-0015_EN.html,Committee on Employment and Social Affairs,Employment & Social Affairs,single vote,1.0,,0,RCV,+,516,23,17,36.0,34.0,139.0,58.0,24.0,77.0,119.0,29.0,0.581,0.466,0.764,0.784,0.421,0.713,0.773,0.707,1,0,0,0,https://oeil.secure.europarl.europa.eu/oeil/popups/ficheprocedure.do?lang=en&reference=2019/0180(COD),https://oeil.secure.europarl.europa.eu/oeil/popups/summary.do?id=1589986&t=e&l=en,"PURPOSE: to enable the European Globalisation Adjustment Fund to support workers made redundant as a result of the likely economic disruptions in the case of a Brexit without a withdrawal agreement. PROPOSED ACT: Regulation of the European Parliament and of the Council. ROLE OF THE EUROPEAN PARLIAMENT: the European Parliament decides in accordance with the ordinary legislative procedure and on an equal footing with the Council. BACKGROUND: the United Kingdom has decided to leave the European Union using the procedure provided for in Article 50 of the Treaty on European Union (TEU). Following a request from the United Kingdom, the European Council agreed on 11 April 2019 to further extend the deadline provided for in Article 50(3) of the TEU until 31 October 2019. Unless the United Kingdom ratifies the withdrawal agreement by 31 October 2019 or requests a third extension and it is adopted unanimously by the European Council, the United Kingdom will leave the Union without agreement and become a third country on 1 November 2019. The European Globalisation Adjustment Fund (EGF) was established by Regulation (EC) No 1927/2006 of the European Parliament and of the Council for the duration of the multiannual financial framework from 1 January 2007 to 31 December 2013. It was established to enable the Union to show solidarity towards workers who lost their jobs as a result of major structural changes in world trade patterns due to globalisation. After analysing the risks, the European Commission concluded that this proposal was necessary to ensure an effective response from the EGF and to show solidarity with workers made redundant in the Union as a result of a withdrawal from the United Kingdom from the Union without a withdrawal agreement. CONTENT: the proposed contingency Regulation should amend Regulation (EU) No 1309/2013 in order to specify that redundancies resulting from the withdrawal of the United Kingdom from the Union without a withdrawal agreement fall within the scope of the EGF. Such a withdrawal would represent a major change in the EU's trade relations and the structure of the internal market and would therefore probably have significant repercussions on business models, growth and employment. The Regulation should enter into force as a matter of urgency on the day following that of its publication in the Official Journal of the European Union and should apply from the date following that on which the Treaties cease to apply in the United Kingdom. However, it should not apply if a withdrawal agreement concluded with the United Kingdom in accordance with Article 50(2) TEU has entered into force by that date."
84,85,10,1,22.10.2019,Implementation and financing of the EU general budget in 2020 in relation to the UK's withdrawal from the EU,***,Leg,Draft legislative resolution,s,Van Overtveldt,A9-0018/2019,2019/0186/APP,https://www.europarl.europa.eu/doceo/document/A-9-2019-0018_EN.html,Committee on Budgets,Budget,vote: consent ,1.0,,0,RCV,+,543,30,46,44.0,15.0,147.0,64.0,25.0,90.0,126.0,32.0,0.71,0.205,0.808,0.865,0.439,0.833,0.818,0.78,1,0,0,0,https://oeil.secure.europarl.europa.eu/oeil/popups/ficheprocedure.do?lang=en&reference=2019/0186(APP),https://oeil.secure.europarl.europa.eu/oeil/popups/summary.do?id=1594772&t=e&l=en,"PURPOSE: to mitigate the negative effects of the United Kingdom's withdrawal on the Union budget and on the implementation of Union policies. PROPOSED ACT: Council Regulation. ROLE OF THE EUROPEAN PARLIAMENT: Council may adopt the act only if Parliament has given its consent to the act. BACKGROUND: this Council draft is part of the Union preparedness and contingency plan to mitigate the most significant disruptions of a withdrawal of the United Kingdom from the Union without a withdrawal agreement. The United Kingdom and persons and entities established in the United Kingdom are participating in a number of Union programmes or actions on the basis of the United Kingdom’s membership in the Union. The participation takes place on the basis of agreements with the United Kingdom or persons or entities established in the United Kingdom or decisions in favour of the United Kingdom or persons or entities established in the United Kingdom which constitute legal commitments. In case of a withdrawal without a withdrawal agreement, it would be beneficial both for the Union and its Member States and for the United Kingdom, and persons and entities established in the United Kingdom, to provide for the eligibility in 2020 of the United Kingdom and beneficiaries established in the United Kingdom to receive Union funds and for the participation of the United Kingdom in the financing of the budget for 2020. It would also be beneficial if the legal commitments signed and adopted before the date of withdrawal, or in 2019 in application of Regulation (EU, Euratom) 2019/1197, could continue to be executed throughout 2020. CONTENT: the draft Council defines the conditions under which the United Kingdom and persons and entities established in the United Kingdom may continue to be eligible in 2020 with regard to agreements signed with them and decisions adopted with regard to them until the date of withdrawal or, where applicable, in 2019 pursuant to the contingency Regulation (Council Regulation (EU, Euratom) 2019/1197). The application of the proposed Regulation is subject to the following conditions: - the United Kingdom has confirmed the commitment in writing to the Commission to continue to pay a contribution calculated on the basis of the estimated own resources from the United Kingdom as set out in the draft budget for 2020 and adjusted to take into account the total amount of payment appropriations set out in the adopted budget for 2020; - a first instalment has been paid by the United Kingdom; - the United Kingdom has confirmed the commitment in writing to the Commission to allow audits and controls in full by the Union in compliance with the applicable rules. As long as the conditions for eligibility of the United Kingdom, and persons and entities established in the United Kingdom continue to be fulfilled, their eligibility should be ensured in 2020 for the purposes of conditions set in calls, tenders, contests or any other procedure which may lead to financing from the Union’s budget, with the exception of specific cases relating to security and the loss of the United Kingdom’s status as a member of the European Investment Bank, and to provide Union funding to them. Such Union funding should be limited to eligible expenditure incurred in 2020, except for public procurement contracts signed before the end of 2020 in application of Title VII of the Financial Regulation, which continue to be implemented in accordance with their terms, and except for the United Kingdom agricultural direct payment scheme for the claim year 2020, which should be excluded from eligibility. The draft regulation also provides for: - the continued eligibility of the United Kingdom and persons and entities established in the United Kingdom provided that the United Kingdom continues to pay the contribution for 2020 and, where applicable, for 2019 under Regulation (EU, Euratom) 2019/1197 and that controls and audits can be carried out effectively; - the continuation, in 2020, of the eligibility of actions under which Member States or persons or entities established in Member States receive funds from the Union and which are related to the United Kingdom. As it lays down measures for the implementation and financing of the Union's budget for 2020, the proposed Regulation should only concern eligibility for the 2020 financial year."
85,86,10,1,22.10.2019,Periods of application of Regulation (EU) 2019/501 and Regulation (EU) 2019/502,***I,Leg,Draft legislative resolution,s,Delli,C9-0108/2019,2019/0179/COD,https://www.europarl.europa.eu/doceo/document/TA-9-2019-0037_EN.html,Committee on Transport and Tourism,Transport & tourism,vote: Commission proposal,1.0,,0,RCV,+,618,0,6,50.0,50.0,147.0,66.0,51.0,92.0,131.0,31.0,0.806,0.685,0.808,0.892,0.895,0.852,0.851,0.756,1,0,0,1,https://oeil.secure.europarl.europa.eu/oeil/popups/ficheprocedure.do?lang=en&reference=2019/0179(COD),https://oeil.secure.europarl.europa.eu/oeil/popups/summary.do?id=1589981&t=e&l=en,"PURPOSE: to amend certain provisions relating to the period of application of two existing regulations in order to ensure basic connectivity for road freight and passenger transport in the case of a Brexit without a withdrawal agreement. PROPOSED ACT: Regulation of the European Parliament and of the Council. ROLE OF THE EUROPEAN PARLIAMENT: the European Parliament decides in accordance with the ordinary legislative procedure and on an equal footing with the Council. BACKGROUND: in order to prepare for the possibility that the United Kingdom could withdraw from the Union without an agreement on 30 March 2019, Regulation (EU) 2019/501 of the European Parliament and of the Council and Regulation (EU) 2019/502 of the European Parliament and of the Council were adopted to ensure basic road freight and road passenger and basic air connectivity between the Union and the United Kingdom. Regulation (EU) 2019/501 and Regulation (EU) 2019/502 shall cease to apply on 31 December 2019 and 30 March 2020 respectively. Following a request from the United Kingdom, the European Council agreed to further extend the deadline provided for in Article 50(3) of the TEU until 31 October 2019. In order to address the impact of the new timeline for the United Kingdom’s withdrawal from the Union, the period of application of those Regulations should be extended, taking into account the core principles underlying contingency measures and their originally intended periods of application. CONTENT: this proposal aims to extend the period of validity of Regulations (EU) 2019/501 and (EU) 2019/502 by seven months, which corresponds to the duration of the extension of the period referred to in Article 50(3) of the TEU. Therefore, it is proposed that Regulation (EU) 2019/501 should cease to apply on 31 July 2020 rather than on 31 December 2019. In addition, in order to ensure that the option provided for in Article 2(3)(d) of Regulation (EU) 2019/501 is available for a meaning period of the same order as that initially provided for, it is necessary to define the period during which cabotage services in the field of road passenger transport may be provided in the border region of Ireland as a six-month period starting from the date of application of that Regulation. This rule should replace the current reference to the date of cessation of application of 30 September 2019. As regards Regulation (EU) 2019/502, the proposal sets 24 October 2020, the end of IATA's 2020 summer season, as the date of cessation of its application. The 12-month period of application initially envisaged would thus be preserved."
149,150,12,1,24.10.2019,Financial assistance to Member States to cover serious financial burden inflicted on them following a UK's withdrawal from the EU without an agreement,***I,Leg,Draft legislative resolution,s,Omarjee,A9-0020/2019,2019/0183/COD,https://www.europarl.europa.eu/doceo/document/A-9-2019-0020_EN.html,Committee on Regional Development,Regional development,Single vote,1.0,,0,RCV,+,511,64,66,45.0,0.0,148.0,63.0,18.0,84.0,118.0,35.0,0.726,0.0,0.813,0.851,0.316,0.778,0.766,0.854,1,0,0,0,https://oeil.secure.europarl.europa.eu/oeil/popups/ficheprocedure.do?lang=en&reference=2019/0183(COD),https://oeil.secure.europarl.europa.eu/oeil/popups/summary.do?id=1589992&t=e&l=en,"PURPOSE: to extend the scope of the European Union Solidarity Fund to cover the significant financial burden that a Brexit without a withdrawal agreement could represent for Member States. PROPOSED ACT: Regulation of the European Parliament and of the Council. ROLE OF THE EUROPEAN PARLIAMENT: the European Parliament decides in accordance with the ordinary legislative procedure and on an equal footing with the Council. BACKGROUND: the United Kingdom has decided to leave the European Union, invoking the procedure set out in Article 50 of the Treaty on European Union (TEU). Following a request from the United Kingdom, the European Council agreed on 11 April 2019 to further extend the deadline provided for in Article 50(3) of the TEU until 31 October 2019. Unless the United Kingdom ratifies the withdrawal agreement by 31 October 2019 or requests a third extension and it is adopted unanimously by the European Council, the United Kingdom will leave the Union without agreement and become a third country on 1 November 2019. The EUSF was created in 2002 to support EU Member States and accession countries in situations of major disasters caused by natural events such as floods, storms, earthquakes, volcanic eruptions, forest fires or drought. The Fund can be mobilised upon an application from the concerned country if the disaster event has a dimension justifying intervention at European level. While it will be a singular event, its disruptive effects and the burden thereof on public finances, directly imputable to the event of a withdrawal without an agreement, could constitute a major disaster and therefore the activation of the “solidarity principle”, which is the core of the EUSF, would be justified in order to mitigate those effects. CONTENT: this proposal aims to amend Council Regulation (EC) No 2012/2002 establishing the European Union Solidarity Fund (EUSF) in order to extend its scope to certain types of additional public expenditure caused by the withdrawal of the United Kingdom from the European Union without agreement. Scope and eligibility Under the amending Regulation, the notion of 'major disasters' would cover natural disasters as well as situations where serious financial burden is inflicted on a Member State as a direct consequence of the withdrawal of the United Kingdom from the Union without an agreement. The Commission proposes to take the financial burden on Member States’ budgets in order to face the additional needs stemming from and directly linked to a withdrawal without an agreement as the reference to determine eligibility. Access to the EUSF would be determined by a minimum level of public expenditure related to the withdrawal without agreement set at 0.3% of GNI or EUR 1.5 billion (whichever is lower), at 2011 prices, half the threshold for natural disasters. It is for the Member State to provide evidence for that expenditure and to demonstrate that it is directly imputable to the withdrawal without agreement. Such assistance may be used, for example, to provide support to businesses affected by the withdrawal without an agreement, including support to State aid measures for those businesses and related interventions; measures to preserve existing employment; and to ensure the functioning of border, customs, sanitary and phytosanitary controls, including additional personnel and infrastructure. VAT shall not constitute eligible expenditure. Procedure The competent national authorities of a Member State could submit to the Commission, by 30 April 2020 at the latest, a single application for a financial contribution from the Fund. The application should include at least all relevant information on the financial burden borne by that Member State. Where the Commission concludes that the conditions for granting a financial contribution from the Fund are met, it should without delay submit to the European Parliament and the Council the necessary proposals to trigger the intervention of the Fund and authorise the corresponding appropriations. When submitting an application for a financial contribution from the Fund to the Commission for serious financial burden caused by the withdrawal of the United Kingdom from the Union without an agreement, a Member State may request the payment of an advance. The Commission therefore proposes to raise the level of advance payments for individual disasters of all categories to 25% of the expected EUSF contribution, limited to a maximum of EUR 100 million. It also proposes to increase the total level of appropriations for EUSF advances in the annual budget from EUR 50 million to EUR 100 million. BUDGETARY IMPLICATIONS: in order to maintain the availability of the EUSF for major natural disasters, which is its original purpose, the use of the EUSF for the purpose of the present proposal should be limited to a maximum of 50% of its annual available amount in 2019 and 2020. The maximum annual allocation of the EUSF is EUR 500 million in 2011 prices. In current prices this means EUR 585.8 million for 2019 plus EUR 597.5 million for 2020, i.e. a total of EUR 1 183.3 million. Up to EUR 591.65 million would therefore be available for the purpose of the current proposal."
293,294,16,1,26.11.2019,EU-Ukraine Agreement Amending the trade preferences for poultry meat and poultry meat preparations provided for by the EU-Ukraine Association Agreement,***,Leg,Draft legislative resolution,s,GYŐRI,A9-0024/2019,2019/0132/NLE,https://www.europarl.europa.eu/doceo/document/A-9-2019-0024_EN.html,Committee on International Trade,International trade,vote: consent,1.0,,0,RCV,+,444,128,74,48.0,1.0,147.0,5.0,23.0,102.0,118.0,0.0,0.774,0.014,0.808,0.068,0.404,0.944,0.766,0.0,1,0,0,0,https://oeil.secure.europarl.europa.eu/oeil/popups/ficheprocedure.do?lang=en&reference=2019/0132(NLE),https://oeil.secure.europarl.europa.eu/oeil/popups/summary.do?id=1589357&t=e&l=en,"PURPOSE: to conclude, on behalf of the Union, the Agreement in the form of an exchange of letters between the European Union and Ukraine amending the trade preferences for poultry meat and poultry meat preparations provided for by the Association Agreement between the European Union and the European Atomic Energy Community and their Member States, of the one part, and Ukraine, of the other part. PROPOSED ACT: Council Decision. ROLE OF THE EUROPEAN PARLIAMENT: Council may adopt the act only if Parliament has given its consent to the act. BACKGROUND: the Association Agreement between the European Union and the European Atomic Energy Community and their Member States, of the one part, and Ukraine, of the other part, entered into force on 1 September 2017. A new type of poultry cut consists of a traditional breast cap with the humerus bones of the wings attached and can, after minimal transformation in the Union, be marketed in the Union as poultry breast. Unlimited imports of those cuts, of which imports from Ukraine reached 55 500 tons in 2018, therefore risk undermining the conditions under which traditional poultry breast cuts may be imported into the Union under the Association Agreement, in particular the quantitative restrictions in the form of a tariff rate quota. On 20 December 2018, the Council authorised the Commission to open negotiations with Ukraine with a view to finding a solution by amending the trade preferences for poultry meat and poultry meat preparations provided for by the Association Agreement. Those negotiations were successfully concluded on 19 March 2019. CONTENT: the purpose of the draft Council Decision is to approve, on behalf of the Union, the Agreement in the form of an exchange of letters between the European Union and Ukraine amending the trade preferences for poultry meat and poultry meat preparations provided for by the Association Agreement between the European Union and the European Atomic Energy Community and their Member States, of the one part, and Ukraine, of the other part."
366,367,18,1,28.11.2019,EU/USA Agreement on the allocation of a share in the tariff rate quota for imports of high-quality beef,***,Leg,Draft legislative resolution,s,Lange,A9-0038/2019,2019/0142/NLE,https://www.europarl.europa.eu/doceo/document/A-9-2019-0038_EN.html,Committee on International Trade,International trade,vote: consent,1.0,,0,RCV,+,457,140,71,57.0,2.0,140.0,5.0,20.0,103.0,130.0,0.0,0.919,0.027,0.769,0.068,0.351,0.954,0.844,0.0,1,0,0,0,https://oeil.secure.europarl.europa.eu/oeil/popups/ficheprocedure.do?lang=en&reference=2019/0142(NLE),https://oeil.secure.europarl.europa.eu/oeil/popups/summary.do?id=1589750&t=e&l=en,"PURPOSE: to review the functioning of an existing trade agreement between the United States of America and the European Union ensuring an autonomous tariff quota for imports of high-quality beef into the EU. PROPOSED ACT: Council Decision. ROLE OF THE EUROPEAN PARLIAMENT: Council may adopt the act only if Parliament has given its consent to the act. BACKGROUND: in 2009, the European Union and the United States concluded a Memorandum of Understanding, revised in 2014, which provided an interim solution to a long-standing dispute in the World Trade Organisation (WTO) over imports of US beef treated with certain growth-promoting hormones. Under the agreement, a 45 000 tonnes quota of non-hormone treated beef was open by the EU to qualifying suppliers. Under WTO rules the quota also had to be made available to non-US suppliers. On 19 October 2018, the Council authorised the Commission to open negotiations between the EU and the United States on the functioning of the tariff quota. Negotiations with the United States were concluded on 27 February 2019. The signed agreement, subject to its conclusion at a later date, must now be approved. CONTENT: the draft Council Decision concerns the approval, on behalf of the European Union, of the Agreement between the EU and the United States on the allocation to the United States of a share in the tariff quota for high-quality beef referred to in the Memorandum of Understanding on the importation of beef from animals not treated with certain growth-promoting hormones and increased duties applied by the United States to certain EU products, which was concluded in 2009 and revised in 2014. Under the new agreement, the existing quota will remain unchanged but 35 000 out of the total 45 000-tonne TRQ will be ring-fenced for the United States and phased in over a period of 7 years. The autonomous tariff quotas will continue to cover only products complying with EU's high food safety and health standards. This step is key to resolving a long-standing dispute between the EU and the United States on measures imposed by the EU in 1989 on US exports of beef treated with certain growth-promoting hormones. It also underlines the EU's commitment to a positive transatlantic trade agenda."
