,Vote ID,File,Order of vote,Date,Title,Procedure,Leg/Non-Leg/Bud,Type of Vote,Voting Rule,Rapporteur,Code,Interinstitutional file number,Link,Committee responsabile,Policy area,Subject,Final vote?,Am No.,Author,RCV,Vote,Yes,No,Abs,ECR,EFD/IDG,EPP,Greens/EFA,NI,REG,S&D,The Left,ECR%,EFD/IDG%,EPP%,Greens/EFA%,NI%,REG%,S&D%,The Left%,General Majority,Right Majority,Left Majority,Consensus,Report link,Summary link,Summary text
6114,6115,71,1,08.02.2021,Control of the acquisition and possession of weapons (codification),***I,Leg,Draft legislative resolution,s,Adamowicz,A9-0010/2021,2020/0029/COD,https://www.europarl.europa.eu/doceo/document/A-9-2021-0010_EN.html,Committee on Legal Affairs,Legal affairs,single vote,1.0,,0,RCV,+,601,77,14,55.0,0.0,169.0,70.0,26.0,101.0,143.0,37.0,0.887,0.0,0.929,0.946,0.456,0.935,0.929,0.902,1,0,0,0,https://oeil.secure.europarl.europa.eu/oeil/popups/ficheprocedure.do?lang=en&reference=2020/0029(COD),https://oeil.secure.europarl.europa.eu/oeil/popups/summary.do?id=1609603&t=e&l=en,"PURPOSE: to lay down minimum provisions on the movement of firearms within the EU (codification of Council Directive 91/477/EEC). PROPOSED ACT: Directive of the European Parliament and of the Council. ROLE OF THE EUROPEAN PARLIAMENT: the European Parliament decides in accordance with the ordinary legislative procedure on an equal footing with the Council. BACKGROUND: Council Directive 91/477/EEC on control of the acquisition and possession of weapons has been substantially amended several times. In the interests of clarity and transparency of the law, the purpose of this proposal is to undertake a codification of Council Directive 91/477/EEC. The proposed new Directive will supersede the various acts incorporated in it; it fully preserves the content of the acts being codified and hence does no more than bring them together with only such formal amendments as are required by the codification exercise itself. CONTENT: the proposed Directive lays down minimum provisions on the movement of firearms in the EU as defined in Annex I (Category A - Prohibited firearms; Category B - Firearms subject to authorisation and Category C - Firearms and other weapons subject to declaration). The Directive shall be without prejudice to the application of national provisions concerning the carrying of weapons, hunting or sporting shooting, where the weapons are legally acquired and held in accordance with the Directive. It shall not apply to the acquisition or possession, in accordance with national law, of arms and ammunition by armed forces, police or public authorities. The Directive shall not affect the power of Member States to take measures to prevent illegal arms trafficking. Member States could adopt stricter provisions in their legislation than those provided for in the Directive. Marking and registration All firearms manufactured in or imported into the Union on or after 14 September 2018 should be clearly, permanently marked and registered without delay after manufacture and, at the latest, before being placed on the market, or without delay after import into the Union. Member States shall: - establish a system including at least: (a) the registration of dealers and brokers operating in the territory of that Member State; (b) the requirement for dealers and brokers to be licensed or authorised in the territory of that Member State; and (c) a check on the professional and private good repute and relevant competence of the dealer or broker concerned; - establish a computerised data file, whether centralised or decentralised, guaranteeing access by the authorised authorities to the data-filing systems in which each firearm covered by the Directive is registered; - ensure that data relating to firearms, including the relevant personal data, are kept by the competent authorities in the data files for a period of 30 years after the destruction of the firearms or essential components in question. Traceability The Directive requires dealers and brokers to keep a record of all entries and exits they make with respect to each firearm, as well as data to enable the identification and tracing of the firearm. Gunsmiths and brokers established on their territory should report firearms transactions to the competent national authorities without undue delay. Acquisition and possession Member States shall permit the acquisition and possession of firearms only by persons who have good cause and who: - are at least 18 years of age, except in relation to the acquisition, other than through purchase, and possession of firearms for hunting and target shooting, provided that in that case persons of less than 18 years of age have parental permission, or are under parental guidance or the guidance of an adult with a valid firearms or hunting licence, or are within a licensed or otherwise approved training centre; - are not likely to be a danger to themselves or others, to public order or to public safety; the fact of having been convicted of a violent intentional crime shall be considered as indicative of such danger. Member States shall: - have in place a monitoring system, which operates continuously or periodically, to ensure that the conditions for the granting of an authorisation laid down by national law are fulfilled for the entire duration of the authorisation ; - lay down rules on the proper monitoring of firearms and ammunition and rules on their proper storage under safe conditions. Member States may take all appropriate measures to prohibit the acquisition and possession of category A firearms, essential components and ammunition. They may grant category A authorisations to marksmen and sportsmen, as well as to recognised museums and, in exceptional and duly substantiated cases, to collectors, subject to strict security measures. Authorisations to possess firearms shall be subject to periodic review at intervals of not more than five years. Deactivation of firearms The risk of acoustic weapons and other types of blank-firing weapons being converted into real firearms is high. Therefore, they shall be included within the scope of Directive. Taking into consideration the high risk of reactivating improperly deactivated firearms, the Directive requires the classification of deactivated firearms under category C (firearms subject to declaration). The deactivation of firearms shall be verified by a competent authority to ensure that modifications made to a firearm render all its essential components permanently inoperable and incapable of being reactived. The Commission shall establish standards and techniques to ensure that all essential components of a firearm are rendered permanently inoperable. Semi-automatic firearms Some dangerous semi-automatic firearms have now been added to category A and are therefore prohibited for civilian use. This is the case for: - short semi-automatic firearms with loading devices over 20 rounds; - long semi-automatic firearms with loading devices over 10 rounds; - semi-automatic long firearms that can be reduced to a length of less than 60 cm without losing functionality by means of a folding or telescoping stock or by a stock that can be removed without using tools. European firearms pass The European firearms pass is a document issued by the competent authorities of a Member State, upon request, to a person who becomes lawfully the holder and user of a firearm. Its maximum period of validity is five years, with the possibility of extension. The European firearms pass would be regarded as the main document required of target shooters and other persons authorised in accordance with this Directive to possess a firearm during a journey to another Member State."
6117,6118,73,3,10.02.2021,Slot utilisation rules at Union airports: temporary relief,***I,Leg,Draft legislative resolution,s,0,C9-0420/2020,2020/0358/COD,https://oeil.secure.europarl.europa.eu/oeil/popups/ficheprocedure.do?lang=en&reference=2020/0358(COD),Committee on Transport and Tourism,Transport & tourism,Vote: Commission proposal,1.0,,0,RCV,+,683,3,4,64.0,63.0,170.0,69.0,35.0,102.0,142.0,38.0,1.032,0.863,0.934,0.932,0.614,0.944,0.922,0.927,1,0,0,0,https://oeil.secure.europarl.europa.eu/oeil/popups/ficheprocedure.do?lang=en&reference=2020/0358(COD),https://oeil.secure.europarl.europa.eu/oeil/popups/summary.do?id=1644131&t=e&l=en,"PURPOSE: to grant aviation stakeholders temporary relief from airport slot use requirements at Community airports for the summer 2021 scheduling season in the context of the COVID-19 pandemic. PROPOSED ACT: Regulation of the European Parliament and of the Council. ROLE OF THE EUROPEAN PARLIAMENT: the European Parliament decides in accordance with the ordinary legislative procedure and on an equal footing with the Council. BACKGROUND: due to the decline in passenger demand caused by the COVID-19 pandemic, air carriers have made major changes to their schedules since 1 March 2020, which have resulted in a slot utilisation rate at coordinated airports falling far below the 80% threshold imposed by the Slot Regulation. This situation is likely to continue to negatively impact air carriers up to and including winter 2024/2025. For the period starting after more than a year of waiving the ‘use-it-or-lose-it’ rule (from 1 February 2020 to 27 March 2021), which preserves air carriers’ 2019 grandfathered slots until the end of the winter 2021/2022 scheduling season, the Commission proposes to establish a pathway to return to a normal application of the ‘use-it-or-lose-it’ rule. The return to normal should not be sudden to avoid destabilising the aviation market to the detriment of air carriers, connectivity, EU consumers, and the environment. It should take place in line with future increases in traffic levels toward 2019 levels or by a stabilisation of air traffic to a new market situation. CONTENT: the Commission proposes that from the start of the summer 2021 scheduling period, the normal application of the slot utilisation requirements of the Slot Regulation should reapply, but that the rate should be set at 40/60 % instead of 80/20 %. Relief should be targeted at air carriers whose intention is to operate their grandfathered slots as soon as demand sufficiently recovers and flights are once again economically viable. Consequently, slot series newly allocated to an air carrier for the first time would not be covered by the planned relief. The proposal foresees a deadline for air carriers to return unwanted slots to the coordinator if they want to benefit from the relief. A deadline of three weeks before the planned operational date for that slot would give airports and other airport service providers visibility on the required capacity and the volume of operations that they are expected to make available adequate infrastructure, facilities and staff. The proposal also clarifies under what circumstances coordinators could withdraw slots from air carriers. The Commission could adopt delegated acts to further extend the period during which the relief applies if the COVID-19 pandemic is not resolved and continues to have a negative impact on the air transport sector, including on historical grandfather rights."
6124,6125,73,7,10.02.2021,Temporary measures concerning the validity of certificates and licences (Omnibus II),***I,Leg,Draft legislative resolution,s,0,C9-0004/2021,2021/0012/COD,https://oeil.secure.europarl.europa.eu/oeil/popups/ficheprocedure.do?lang=en&reference=2021/0012(COD)),Committee on Transport and Tourism,Transport & tourism,Vote: Commission proposal,1.0,,0,RCV,+,647,24,19,64.0,63.0,170.0,69.0,33.0,102.0,136.0,10.0,1.032,0.863,0.934,0.932,0.579,0.944,0.883,0.244,1,0,0,0,https://oeil.secure.europarl.europa.eu/oeil/popups/ficheprocedure.do?lang=en&reference=2021/0012(COD),https://oeil.secure.europarl.europa.eu/oeil/popups/summary.do?id=1646974&t=e&l=en,"PURPOSE: to authorise, exceptionally in the context of the current COVID-19 pandemic, the extension of the validity of certificates, licences or authorisations and of certain time limits in certain areas of transport legislation. PROPOSED ACT: Regulation of the European Parliament and of the Council. ROLE OF THE EUROPEAN PARLIAMENT: the European Parliament decides in accordance with the ordinary legislative procedure and on an equal footing with the Council. BACKGROUND: due to the COVID-19 crisis, Regulation (EU) 2020/698 extended for a period of 6 months (or 7 months in some cases) the period of validity of certain certificates, licences and authorisations and postponed the completion of certain periodic checks and continuing training which, under the relevant EU legislation, should have taken place during the period between 1 March 2020 (or 1 February 2020 in some cases) and 31 August 2020. Some Member States have submitted reasoned requests to the Commission for authorisation to extend certain periods again. The Commission has adopted six decisions authorising such extensions. Despite some improvements in the situation during the summer of 2020, the persistence of the pandemic in the third quarter of 2020 forced Member States to maintain or even reinforce the measures taken to prevent the spread of the disease. As a consequence, transport operators may not be able to complete the formalities or procedures necessary to comply with certain provisions of EU law on the renewal or extension of certificates, licences or approvals, or on the completion of periodic checks and continuous training, or to take other necessary steps to maintain their validity, as was the case in spring 2020. The Commission therefore considers it necessary to adopt measures to remedy these problems and to ensure both legal certainty and the proper functioning of the legal acts concerned. CONTENT: the proposal aims to establish temporary measures applicable to the renewal and extension of the validity of certain certificates, licences and authorisations and to the postponement of certain periodic checks and periodic training in response to the exceptional situation arising from the spread of COVID-19 in the fields of road, rail and inland waterway transport and maritime security during reference periods subsequent to those referred to in Regulation (EU) 2020/698. The proposal provides for adaptations, in particular for certain time limits, as well as the possibility for the Commission to authorise extensions on the basis of a request submitted by any Member State by 1 April 2021 at the latest. Such extensions should be limited to what is necessary in view of the period during which the completion of formalities, procedures, checks and training are likely to remain impracticable and, in any event, should not exceed six months. The proposal concerns specific provisions which affect the application of several directives and regulations concerning in particular: - the initial qualification and periodic training of drivers of certain road vehicles for the carriage of goods or passengers for driving licences; - tachographs in road transport; - the periodic technical inspection of motor vehicles and their trailers; - the conditions to be complied with to pursue the occupation of road transport operator; - access to the international road haulage market and access to the international market for coach and bus services; - railway safety, the certification of train drivers operating locomotives and trains on the railway system in the Union and the rules establishing a single European railway area; - the conditions for obtaining boatmasters' certificates for the carriage of goods and passengers by inland waterway in the Union, technical requirements for inland waterway vessels and the improvement of ship and port facility security. The Regulation should enter into force as a matter of urgency so that the situations of legal uncertainty affecting many authorities and operators in different sectors are minimised."
6433,6434,73,1,10.02.2021,Markets in financial instruments,***I,Leg,Draft legislative resolution,s,Ferber,A9-0208/2020,2020/0152/COD,https://www.europarl.europa.eu/doceo/document/A-9-2020-0208_EN.html,Committee on Economic and Monetary Affairs,Economic & monetary affairs,Provisional agreement,0.0,12,committee,RCV,+,339,294,57,59.0,2.0,164.0,0.0,14.0,98.0,2.0,0.0,0.952,0.027,0.901,0.0,0.246,0.907,0.013,0.0,0,1,0,0,https://oeil.secure.europarl.europa.eu/oeil/popups/ficheprocedure.do?lang=en&reference=2020/0152(COD),https://oeil.secure.europarl.europa.eu/oeil/popups/summary.do?id=1626385&t=e&l=en,"PURPOSE: to make targeted adjustments to the requirements of the Markets in Financial Instruments Directive (MIFID II) to facilitate the economic recovery post COVID-19 pandemic. PROPOSED ACT: Directive of the European Parliament and of the Council. ROLE OF THE EUROPEAN PARLIAMENT: the European Parliament decides in accordance with the ordinary legislative procedure and on an equal footing with the Council. BACKGROUND: Directive 2014/65/EU on markets in financial instruments (MiFID II) lays down rules for investment firms operating in EU financial markets. These rules determine how investment firms should interact with investors and how they should organise the trading venues. The rules on investment services have an important role to play in promoting the recapitalisation of European firms in the aftermath of the crisis. In the light of the current COVID-19 pandemic, formal burdens that are not strictly necessary should be removed. The Commission therefore strives to recalibrate investor protection requirements to strike the right balance between a sufficient level of transparency for the client, the highest standards of protection and acceptable compliance costs for firms. This legislative proposal amending MiFID II is part of a set of measures to facilitate the economic recovery post-COVID-19 pandemic, which includes also legislative proposals amending the Prospectus Regulation the Securitisation Regulation and the Capital Requirements Regulation. CONTENT: the proposal primarily aims at providing, for exceptional reasons in the context of the current COVID-19 pandemic, for a streamlined application of the regulatory requirements, keeping high safeguards for retail clients while allowing for more flexibility for wholesale clients and ensures that fully functioning commodity markets can play their important role in the recovery of EU economies. This legislative proposal also aims to complement the objectives of the Capital Markets Union to diversify market-based sources of financing for European companies and facilitate cross-border investments. Amendments to information requirements The changes to the current regime provide a precise calibration of the rules applicable to retail clients, professional customers and eligible counterparties. The majority of the proposed changes shall consist of relief for professional clients and eligible counterparties, namely: - the phasing out of paper-based default method: documents shall be provided in electronic format. However, retail clients may opt-in to paper based information; - as regards the indication of costs and charges, the introduction of an exemption for eligible counterparties and professional clients for services other than investment advice and portfolio management. In addition, in case of distance communication all clients using all services shall be able, under certain conditions, to receive costs and charges information just after the transaction; - lighter ex-post reporting obligations: these reports shall no longer apply in respect of eligible counterparties; professional clients shall be able to choose whether or not to receive them; - the temporary suspension of best execution reporting; - the waiver by professional investors of cost-benefit analysis in the event of a change of product during the course of the relationship; - the lifting of the product governance requirements for simple corporate bonds with make-whole clauses (which are investor-protective features). The aim of this exemption is to make more plain vanilla corporate bonds available to retail investors. Measures affecting energy derivatives markets The proposal introduces changes to the regime applicable to commodities with a view to enabling businesses in the real economy to cope with market volatility, while at the same time allowing the emergence of new commodity contracts, which is also important for promoting the international role of the euro. The proposed amendments recalibrate precisely the position limit regime and the scope of the hedging exemption. They shall not concern agricultural commodities, in particular products for human consumption."
6578,6579,77,2,10.03.2021,Equivalence of forest reproductive material produced in the UK,***I,Leg,Draft legislative resolution,s,0,C9-0430/2020,2020/0378/COD,https://oeil.secure.europarl.europa.eu/oeil/popups/ficheprocedure.do?lang=en&reference=2020/0378(COD),Committee on Agriculture and Rural Development,Agriculture,Vote: Commission proposal,1.0,,0,RCV,+,617,1,77,64.0,63.0,174.0,2.0,33.0,102.0,142.0,37.0,1.032,0.863,0.956,0.027,0.579,0.944,0.922,0.902,1,0,0,0,https://oeil.secure.europarl.europa.eu/oeil/popups/ficheprocedure.do?lang=en&reference=2020/0378(COD),https://oeil.secure.europarl.europa.eu/oeil/popups/summary.do?id=1645317&t=e&l=en,"PURPOSE: to amend Council Decision 2008/971/EC as regards the equivalence of forest reproductive material produced in the United Kingdom to such material produced in the EU. PROPOSED ACT: Decision of the European Parliament and of the Council ROLE OF THE EUROPEAN PARLIAMENT: the European Parliament decides in accordance with the ordinary legislative procedure and on an equal footing with the Council. BACKGROUND: in view of the end of the transitional period provided for in the withdrawal agreement, the United Kingdom has applied to the Commission for recognition of the equivalence, from 1 January 2021, of forest reproductive material produced in that country with that produced in the EU in accordance with the respective Union law. The Commission has examined the relevant legislation of the United Kingdom. It has concluded that forest reproductive material, and in particular the categories ‘source-identified’, ‘selected’ and ‘qualified’ material, produced in the United Kingdom is equivalent to forest reproductive material produced in the EU, since the former affords the same assurances as regards the approval of its basic material and the measures taken for its production with a view to marketing as the latter. CONTENT: the proposal adds the United Kingdom to the list of countries for which the Union recognises the equivalence of forest reproductive material, and in particular the categories ‘source-identified’, ‘selected’ and ‘qualified’ material, with the respective material produced within the Union. This recognition is based on an examination of the legislation applicable in the United Kingdom and the conclusion that its requirements and systems in place are equivalent to those of the Union. Following the addition of the United Kingdom to the list of countries in Annex I to Decision 2008/97/EC, imports into the Union of forest reproductive material from the United Kingdom would be authorised."
